{
  "$schema": "https://json-schema.org/draft/2020-12/schema",
  "title": "ProfileV3",
  "description": "A strict, portable profile used as planner input.",
  "type": "object",
  "properties": {
    "created_at": {
      "description": "Time this profile revision was created.",
      "type": "string",
      "format": "date-time"
    },
    "defaults": {
      "description": "Profile-wide continuation defaults. Mode and output remain command-owned.",
      "$ref": "#/$defs/ProfileDefaultsV3",
      "default": {
        "continue_on_error": false
      }
    },
    "description": {
      "description": "Optional operator-facing explanation.",
      "type": [
        "string",
        "null"
      ]
    },
    "expires_at": {
      "description": "Optional profile expiry; an expired profile cannot produce a plan.",
      "type": [
        "string",
        "null"
      ],
      "format": "date-time"
    },
    "metadata": {
      "description": "Profile-author metadata with no execution semantics.",
      "type": "object",
      "additionalProperties": true
    },
    "name": {
      "description": "Operator-facing name.",
      "type": "string"
    },
    "profile_id": {
      "description": "Profile identity.",
      "$ref": "#/$defs/ProfileId"
    },
    "schema_version": {
      "description": "Version marker for strict decoding.",
      "$ref": "#/$defs/SchemaVersion"
    },
    "steps": {
      "description": "Dependency-aware requested steps.",
      "type": "array",
      "items": {
        "$ref": "#/$defs/ProfileStepV3"
      }
    },
    "version": {
      "description": "Profile revision chosen by the profile author.",
      "type": "string"
    }
  },
  "additionalProperties": false,
  "required": [
    "schema_version",
    "profile_id",
    "name",
    "version",
    "created_at",
    "steps"
  ],
  "$defs": {
    "ActionId": {
      "description": "Stable identity of an action in a profile or plan.",
      "type": "string",
      "format": "uuid"
    },
    "CapabilityId": {
      "description": "A bounded, non-empty capability key (for example `defender.health`).",
      "type": "string"
    },
    "ProfileDefaultsV3": {
      "description": "Profile-wide execution defaults that never authorize mutation or output paths.",
      "type": "object",
      "properties": {
        "continue_on_error": {
          "description": "Continue after a failed step for audit and plan operations.",
          "type": "boolean",
          "default": false
        }
      },
      "additionalProperties": false
    },
    "ProfileId": {
      "description": "Stable identity of a profile.",
      "type": "string",
      "format": "uuid"
    },
    "ProfileStepV3": {
      "description": "One dependency-aware unit of operator-requested work.\n\nA profile step intentionally cannot select an operation or declare its own\nsafety properties. The trusted planner obtains those values from its\ncapability registry when it derives a [`PlannedActionV3`].",
      "type": "object",
      "properties": {
        "capability_id": {
          "description": "Registered capability implementing this work.",
          "$ref": "#/$defs/CapabilityId"
        },
        "continue_on_error": {
          "description": "Continue after a failed step for audit and plan only. Apply always fails fast.",
          "type": "boolean",
          "default": false
        },
        "depends_on": {
          "description": "Step identities that must complete successfully first.",
          "type": "array",
          "items": {
            "$ref": "#/$defs/ActionId"
          }
        },
        "parameters": {
          "description": "Capability-defined typed parameters.",
          "type": "object",
          "additionalProperties": true
        },
        "step_id": {
          "description": "Step identity, unique within its profile.",
          "$ref": "#/$defs/ActionId"
        }
      },
      "additionalProperties": false,
      "required": [
        "step_id",
        "capability_id"
      ]
    },
    "SchemaVersion": {
      "description": "Wire version for every v3 document.",
      "oneOf": [
        {
          "description": "`BaselineOps` v3.0 contract.",
          "type": "string",
          "const": "3.0"
        }
      ]
    }
  }
}
