{
  "schema_version": "3.0",
  "profile_id": "11111111-1111-4111-8111-111111111111",
  "name": "Identity and Defender audit",
  "version": "1.0.0",
  "description": "Wave 1 vertical-architecture profile.",
  "created_at": "2026-08-10T00:00:00Z",
  "defaults": {
    "continue_on_error": false
  },
  "steps": [
    {
      "step_id": "22222222-2222-4222-8222-222222222222",
      "capability_id": "v3.identity.join"
    },
    {
      "step_id": "33333333-3333-4333-8333-333333333333",
      "capability_id": "v3.defender.health",
      "depends_on": [
        "22222222-2222-4222-8222-222222222222"
      ]
    }
  ]
}
